{"base_url":"https://ondestaanocas.pages.dev","counts":{"destinations":8,"low_prices":6,"origins":3,"promotions_expired":1,"promotions_live":1,"routes":10},"currency":"EUR","detector":{"lookback_days":90,"low_threshold":0.15,"max_offer_age_days":3,"min_baseline_days":4,"min_saving_eur":15.0,"threshold":0.3},"files":{"destinations":"destinations.json","labels":"labels.json","low_prices":{"FAO":"low-prices/FAO.json","LIS":"low-prices/LIS.json","OPO":"low-prices/OPO.json"},"origins":"origins.json","promotions":"promotions.json","routes":"routes.json"},"fixture":true,"generated_at":"2026-10-13T17:20:41Z","run":{"finished_at":"2026-10-13T17:20:41Z","id":18},"version":1}
